button_confirm,확인
button_cancel,취소
button_next,다음
button_claim,획득
button_bgm,배경음
button_sfx,효과음
button_help,도움말
button_credit,크레딧
button_language,언어
main_start,시작
settlement_total,총 매출
settlement_employee,직원 급여
settlement_netIncome,순수익
settlement_double_info,도장을 사용해서 수익을 \두 배로 얻으세요!
settlement_double_confirm,확인
settlement_double_cancel,취소
shop_employee_category,아르바이트
shop_employee_buy,고용하기
shop_upgrade_category,업그레이드
shop_upgrade_buy,구입
panel_empty,비어있는 슬롯이 있습니다.\계속하시겠습니까?
panel_daily,하루에 한 번 출석으로 \왁두 도장을 획득하세요! 도장을 통해 수입을 \두 배로 늘릴 수 있습니다!
tutorial_start_ment1,안녕하세요! 저는 가게 운영을 도와주러 온 팬치입니다! 
tutorial_start_ment2,Play 버튼을 눌러 가게로 이동하세요!
tutorial_start_ment3,아직은 조합대만 해금되어 있어요. 조합대는 여기에 있습니다.
tutorial_start_ment4,가까이 다가가서 Open 버튼을 누르면 조리를 시작할 수 있습니다. 조합대로 이동해 주세요!
tutorial_start_ment5,"먼저, 도움말 버튼을 눌러 자세한 조리 방법을 확인해 보세요."
tutorial_start_ment6,이제 주문을 받아 보죠! 주문이 들어오면 이곳에 영수증이 표시됩니다.
tutorial_start_ment7,주문 영수증을 눌러 자세한 정보를 확인해 봅시다.
tutorial_start_ment8,이제 실전입니다! 손님들에게 맛있는 버거를 제공하세요!
tutorial_settlement_ment1,이제 10시가 되어 하루의 영업이 마무리되었습니다.
tutorial_settlement_ment2,일일 출석으로 얻을 수 있는 도장으로 두 배 보상을 받을 수 있습니다.
tutorial_settlement_ment3,한번 해 볼까요? 이번에는 공짜입니다!
tutorial_settlement_ment4,좋아요! 이제 상점으로 가시죠!
tutorial_dispenser_ment1,디스펜서가 해금되었습니다. 이제부터 음료수를 제조할 수 있습니다!
tutorial_dispenser_ment2,그럼 가게로 가서 확인해볼까요? 준비가 끝나면 Play 버튼을 눌러주세요!
tutorial_dispenser_ment3,설치가 완료되었군요! 디스펜서는 여기에 있습니다.
tutorial_dispenser_ment4,가까이 가서 Open 버튼을 눌러 주세요.
tutorial_grill_ment1,그릴이 해금되었습니다. 이제부터 패티를 구울 수 있습니다.
tutorial_grill_ment2,준비가 끝나면 Play 버튼을 눌러주세요.
tutorial_grill_ment3,설치가 완료되었네요! 그릴은 우측에 있습니다.
tutorial_grill_ment4,그릴으로 가서 Open 버튼을 눌러 주세요.
tutorial_prep_ment1,프랩이 해금되었습니다. 드디어 야채를 먹을 수 있겠군요!
tutorial_prep_ment2,준비가 끝나면 Play 버튼을 눌러주세요.
tutorial_prep_ment3,설치가 완료되었네요! 프랩은 여기에 있습니다.
tutorial_prep_ment4,가까이 가서 Open 버튼을 눌러 주세요.
tutorial_fryer_ment1,튀김기가 해금되었습니다. 감자튀김은 필수죠!
tutorial_fryer_ment2,준비가 끝나면 Play 버튼을 눌러주세요.
tutorial_fryer_ment3,이제 모든 설비를 갖추었네요! 튀김기는 \여기에 있습니다.
tutorial_fryer_ment4,가까이 가서 Open 버튼을 눌러 주세요.
tutorial_employee_ment1,아르바이트 기능이 해금되었습니다. 조리를 대신 맡길 수 있습니다.
tutorial_employee_ment2,아르바이트 탭으로 이동해 주세요.
tutorial_employee_ment3,이곳에서 직원 고용 카드를 구매해 보세요. 첫 구매 비용은 제가 드릴게요!
tutorial_employee_ment4,좋아요. 이제 획득한 카드들을 확인해 봅시다. My Card를 눌러주세요.
tutorial_employee_ment5,이런! 슬롯이 다 잠겨 있군요! 직원을 등록하기 위해서는 기능 강화를 통해 슬롯을 늘려야 합니다.
tutorial_employee_ment6,업그레이드 탭으로 이동하세요. 그곳에서 기능을 강화시킬 수 있습니다.
tutorial_employee_ment7,"Employee를 강화하여 슬롯을 개방하세요. 이번에도 처음이니까, 무료로 해 드릴게요!"
tutorial_employee_ment8,업그레이드가 완료되었습니다! 이제 카드 관리창을 다시 열어주세요.
tutorial_employee_ment9,"슬롯이 하나 개방되었습니다. 이제 원하는 카드를 선택하고, 장착해야 합니다."
tutorial_employee_ment10,"장착을 하면, 직원에게 업무를 지정해 주어야 합니다."
tutorial_employee_ment11,"준비가 완료되면, Play 버튼을 눌러 가게로 이동해 주세요."
tutorial_employee_ment12,직원은 이곳에 표시됩니다. 직원이 완성한 재료는 자동으로 조합대에 추가됩니다.
tutorial_employee_ment13,직원 아이콘을 클릭하면 작업을 멈추게 할 수 있습니다.
tutorial_employee_ment14,"직원들에게 일일 수당을 지불해야 한다는 점, 주의하세요!"
tutorial_employee_ment15,"자, 이제 실전입니다! 행운을 빌어요!"
tutorial_employee_error,"보통은 슬롯에 아무것도 넣지 않아도 되지만, 이번에는 안내를 위해 장착해 주시는 것이 좋겠네요!"
help_receipt_ment1,"일정 주기마다 손님이 주문을 합니다. 주문이 빨리 해소될수록, 손님의 방문이 빨라집니다."
help_receipt_ment2,하트 게이지가 다 사라지게 되면 손님이 떠나게 됩니다.
help_receipt_ment3,손님의 영수증을 누르면 자세한 정보를 확인할 수 있습니다. 
help_receipt_ment4,하단에 가격이 표시됩니다. 강도는 돈을 주지 않습니다.
help_plating_ment1,제조를 시작하기 전에 레시피를 확인합니다. 주문이 들어오면 \좌측 상단에 주문 영수증이 표기됩니다.
help_plating_ment2,"주문 영수증을 누르면 자세한 정보를 확인할 수 있습니다. 주문을 잘 확인하세요! 도둑은 돈을 주지 않습니다!"
help_plating_ment3,레시피 순서대로 재료를 쌓아 요리를 완성하세요. 우측 하단의 \쓰레기통 버튼을 눌러 잘못 만든 요리를 버릴 수 있습니다.
help_plating_ment4,"요리가 완성되면 벨을 눌러 손님에게 전달하세요. 완성된 요리가 레시피와 다르다면, 재료들은 원상복구됩니다."
help_dispenser_ment1,"움직이는 컵이 원하는 음료 위치에 있을 때,\PUSH 버튼을 눌러 성공적으로 멈추면 음료가 나오고,\다시 PUSH버튼을 눌러 음료를 얻을 수 있습니다!"
help_dispenser_ment2,"음료를 얻은 후, 다시 PUSH버튼을 누르면 컵이 다시 생성됩니다."
help_employee_ment1,"원하는 직원을 누르고 장착 버튼을 눌러 장착합니다. 장착 시 카드 1장을 소모합니다."
help_employee_ment2,장착한 직원에게 업무를 지정해 주어야 합니다. 직원 장착 슬롯 옆의 섹션 선택 슬롯을 눌러 원하는 업무를 선택해 주세요.
help_employee_ment3,낮은 등급의 카드 10장을 소모하여 높은 등급의 무작위 직원 카드 하나를 얻을 수 있습니다. 최대 등급은 S등급 입니다.
help_grill_ment1,그릴 위의 패티 슬롯을 눌러 패티를 올릴 수 있습니다.
help_grill_ment2,"익힘의 정도에 따라 슬라이더의 색상이 변합니다. 다 익은 패티를 뒤집거나 획득하세요. 너무 오랫동안 방치하면 타 버립니다!"
help_grill_ment3,"한쪽 면이 다 익으면 뒤집어서 반대쪽 면도 익혀주세요. 반대쪽 면도 다 익으면 패티를 얻을 수 있습니다."
help_grill_ment4,"패티가 타게 되면 그릴에서 탄 연기가 올라오고, 소리가 들려옵니다."
help_prep_ment1,"올라오는 야채들을 썰어서 획득하세요!"
help_fryer_ment1,"튀김기를 눌러 감자를 튀길 수 있습니다."
help_fryer_ment2,"익힘의 정도에 따라 튀김, 슬라이더의 색상이 변합니다. 다 익은 튀김을 눌러서 획득하세요. 너무 오랫동안 방치하면 타 버립니다!"
help_fryer_ment3,"감자튀김이 타게 되면 튀김기에서 탄 연기가 올라오고, 소리가 들려옵니다."
info_nocurruncey,잔액이 부족합니다.
info_nostamp,남아있는 왁두 도장이 없습니다.
info_dailygranted,일일 보상을 획득하였습니다.
info_already_dailygranted,오늘은 이미 보상을 획득하셨습니다.
info_Invalid_recipe,레시피와 일치하는 주문이 없습니다.
info_require_section,직원이 작업할 섹션을 선택해야 합니다.
info_stampfull,도장이 가득 찼습니다.
info_noselect_card,카드를 선택해야 합니다.
info_notenough_card,업그레이드에 필요한 카드가 부족합니다.
info_upgrade_full,이미 최고 등급입니다.
event_time_next,다음 보상까지
event_redeem_locked,잠김
event_redeem_unlock,보상 수령!
event_redeem_redeemed,수령 완료
event_title,접속 보상 이벤트
event_description,WakBurger 출시를 기념해 일정 시간 이상 접속하신 모든 분들께 특별한 선물을 드립니다!
event_clear,이벤트 완료!
event_time_end,이벤트가 종료되었습니다.
redeem_main,쿠폰 코드 등록
redeem_info,* 받은 코드는 복사한 뒤 ZEPETO 설정 > 쿠폰 등록에서 등록할 수 있습니다.\* ios 유저는 푸짐한집 계정의 피드 URL을 통해 등록할 수 있어요.(@cba0898)
receipts_14_1,박사님이 포장해달라고 부탁했습니다!
receipts_14_2,이렇게 주십시오~!
receipts_14_3,키@&ㅇ아!#^!~
receipts_15_1,"어이, 버거 하나 줘!"
receipts_15_2,버거를 주문하는게 자네에게 너무 [버거]운가? 크하하하
receipts_15_3,이 집을 자주 찾게 되는군. 아주 마음에 들어.
receipts_17_1,치즈.
receipts_17_2,님. 주문. 치즈.
receipts_17_3,치즈!!
receipts_18_1,아 배고파. 빨리 주세요~
receipts_18_2,이거 깊티 사용 되나요?
receipts_18_3,"아, 뭐 먹지? 완전 고민되는데? 추천해 주세요~!"
receipts_19_1,"으이? 내가 뭘 주문했더라?
receipts_19_2,이 도파민은 배가 너무 고파요.
receipts_19_3,으이...오늘은 통 크게 먹을꺼에요.
receipts_20_1,안녕하시무니까? 햄버거 하나 부탁하무니다.
receipts_20_2,오레노 차크라가 부족하무니다. 얼른 음식을 주십시오.
receipts_20_3,홀리몰리 롤리폴리 할리갈리 과카몰리 캘리칼리 왁?
receipts_21_1,저는 13남자기 때문에 이정도는 먹어줘야 한다구요.
receipts_21_2,오니! 여기 버거 맛이 살살 녹아요.
receipts_21_3,"오니.. 너무 배고파요..."
receipts_22_1,여기 햄버가 하나 듀뎨여.
receipts_22_2,여기 버거 맛이 날 밀어내는 척하며 계속 끌여당겨 날
receipts_22_3,주문할테니 팅얼대지 먀요.
receipts_23_1,여기 햄버거 하나 주세요.
receipts_23_2,"세트 6개 따로 포장해주세요. 제가 먹을건 아니고, 우리 아이돌 분들 먹을거라서!"
receipts_23_3,"하하하, 맞습니다. 제가바로 대상현 뢴트게늄입니다."
receipts_24_1,햄버거 하나 주문하겠습니다.
receipts_24_2,이 햄버거에 잘 어울리는 칵테일이 있는데 한번 드셔보겠습니까?
receipts_24_3,"아, 오셨군요. 주문하려고 기다리고 있었습니다."
receipts_25_1,햄버거 하나 주세요.
receipts_25_2,오늘은 정의로운 도둑이 될까 고민했지만 참겠습니다.
receipts_25_3,"주님, 오늘도 맛있는 햄버거를 주문하는 것을 허락해주세요."
receipts_26_1,"천박한 것, 버거하나 주게."
receipts_26_2,내 친히 여기 단골이 되어주겠네.
receipts_26_3,오늘은 펼쳐진 푸른하늘 아래 이 햄버거로 피크닉을 즐기고 싶네.
receipts_27_1,버거 하나 주십시오.
receipts_27_2,햄버거의 색깔은 무슨 색인지 아십니까? 정답은 버건디 색 입니다. 하하하.
receipts_27_3,햄버거의 이상형은? 바로 [치즈]할 수 있는 사람입니다. 하하하.
receipts_29_1,"나 햄버거 좋아하는디, 하나만 주시게."
receipts_29_2,주문하고 나서 기다리는 시간이 설렘의 시작이지!
receipts_29_3,내 마법으로도 이 맛은 못살려!
receipts_30_1,[도둑]\안녕하세요? 생계형 도둑입니다. 버거 하나 가져가도 되겠습니까?
receipts_30_2,[도둑]\버거를 빨리 주시지 않으시면 일방적인 도둑으로 전환 할 수 밖에 없을 것 같습니다.
receipts_30_3,[도둑]\토핑으로 고수를 넣어주실 수는 없는 건가요?
receipts_32_1,세트로 사는게 좋은지 단품으로 사는게 좋은지 심리적으로 생각해볼 가치가 있는 주제라고 생각합니다.
receipts_32_2,햄버거의 가장 이상적인 비율로 재료를 쌓으면 그 맛의 차이가 확연하게 드러납니다.
receipts_32_3,햄버거는 다양한 영양소가 들어간 완전제품이라고 하지만 다량을 섭취하게 되면 건강을 해칠 우려가 있습니다.
receipts_33_1,내꺼는 야채 팍팍 넣어주고 그랴
receipts_33_2,거 내가 깡통 500원 씩 팔아서 모은 돈인데 좀 깍아줘~
receipts_33_3,"여기가 참 맛집이여, 이게 내 셰샹이여"
receipts_35_1,제가 햄버거를 시켜도 될까요...?
receipts_35_2,제가 줄수 있는 건 같잖은 가짜가 갓 짠 값싼 가사와 각자의 과찬에 감사
receipts_35_3,부대에서 먹는 맛이랑은 차원이 다르네요...
receipts_36_1,이 곳에서 파는 햄버거는 정말 고급진 느낌이에요!
receipts_36_2,이 가격에 이렇게 맛있는 햄버거를 먹을 수 있다니 대박이에요!.
receipts_36_3,"이 햄버거의 가격.. 말도 안돼요..!"
receipts_37_1,"햄버거 하나 주세요."
receipts_37_2,이 햄버거는 다른 곳에서 먹는 것보다 맛있어.
receipts_37_3,여긴 사이드가 더 맛있는 것 같아.
receipts_38_1,"햄버거 주문, 지금 가능한가요?"
receipts_38_2,여기서 파는 햄버거는 먹으면 먹을수록 매력적이에요.
receipts_38_3,"여기서 파는 햄버거는 정말 최고에요. 맛도 풍부하고 신선해요!"
receipts_39_1,"햄버거 하나요, 포장이요."
receipts_39_2,"이 햄버거만 보면 식욕 폭발해. 한입에 행복이 가득하달까?"
receipts_39_3,"여기 햄버거는 정말 일품이야. 다른 곳에서는 맛볼 수 없어."